{
  "schema_version": 1,
  "baseline_id": "BASELINE-2026-08-21-INITIAL",
  "captured_at": "2026-08-21T00:00:00+08:00",
  "source_snapshots": [
    { "file": "GLOBAL_POLICY.md", "section": "entire file", "source_sha256": "62ae1891c04084f9396a5a79db271657e22256e52cef14ec348e97edfad2f9ba" },
    { "file": "SPEC_KIT_REFERENCE.md", "section": "entire file", "source_sha256": "370451705a094f4330c6de81a058e59ab09801ee88496debf1e2cfa6d41bf532" },
    { "file": "README.md", "section": "entire file", "source_sha256": "4885adc9d6d018c8e64961e56be16605955f3d35ad1b56da5f957b5ca5d28ff5" },
    { "file": "AGENTS.md", "section": "entire file", "source_sha256": "2eb37dc52d0d49511f0f8a94c3e8b9a2359c08bd30d11fea610e5b6daea6877c" },
    { "file": "UPSTREAM_BASELINE", "section": "entire file", "source_sha256": "540ba5c85dbc55f6116969cbcfc9fbcd46e8fb57242e421e93e17bd3759a1fd4" },
    { "file": "docs/UPSTREAM_UPDATE_POLICY.md", "section": "entire file", "source_sha256": "5296eafc6b462643de911531d2f1166511b4adb8b4007548956471f87e54eb38" },
    { "file": "docs/CHANGE_IMPACT.md", "section": "entire file", "source_sha256": "aab2e52413c050421922c30950bd920dc0ccddd4eae812954669bc15304d0c32" },
    { "file": "docs/HISTORY.md", "section": "entire file", "source_sha256": "dea4ffc580fbff46d38f4521a5c94c706d331f533939b713f4d267ef9f4f22f6" },
    { "file": "scripts/check_upstream.py", "section": "entire file", "source_sha256": "6562a02d22e1d9aec2bd39700a3bcb3a62b720177cfa3a814b59702284c62cf1" },
    { "file": "scripts/check-upstream.sh", "section": "entire file", "source_sha256": "8855f1054fc1d2a0c89d503167cf1d5007d64dfbf279a934bf757dbe0234f3e9" },
    { "file": "scripts/check-upstream.ps1", "section": "entire file", "source_sha256": "9ed591fb4b2451aa6088409611b0962c2cd591c9cfd581232217e4645840807c" },
    { "file": "governance/project/GOVERNANCE_LOADER.md", "section": "entire file", "source_sha256": "76c97e0a42c0a35bc5171370bbf032dab5c47ecf24488ad0b1afdae5eb52c4a7" },
    { "file": "governance/project/REFERENCE_UPDATE_CHECK.md", "section": "entire file", "source_sha256": "be7e51077f4784ed65af6410d3788cc23106e614ca9778d5b5442128fa6aac9a" },
    { "file": "docs/SPEC_KIT_GOVERNANCE_ENHANCEMENT_IMPLEMENTATION_PLAN_2026-09-04.md", "section": "entire file", "source_sha256": "5eb72d77134e5a3dbb9a05f14791454e8a060e47b1de87f221695bd1b8f054bf" },
    { "file": ".github/workflows/check-spec-kit-upstream.yml", "section": "entire file", "source_sha256": "e63a8105c8a3eee09f75f687a639d2c281059aaf28ace550c551fcaee610d508" }
  ],
  "capabilities": [
    { "id": "CAP-SUBSTANTIVE-WORK-USES-SPEC-KIT", "source": { "file": "GLOBAL_POLICY.md", "section": "Project detection", "source_sha256": "158693d831fd5ed2126aa458058a1144bbf57ffedcffb05dd81bf3d830cb935d" }, "requirement": "Use Spec Kit for substantive software engineering work.", "disposition": "MOVE", "targets": ["GLOBAL_POLICY.md", "governance/project/POLICY.md"], "tests": ["test_substantive_work_requires_speckit"], "approval": null },
    { "id": "CAP-LIGHTWEIGHT-WORK-AVOIDS-CEREMONY", "source": { "file": "GLOBAL_POLICY.md", "section": "Project detection", "source_sha256": "158693d831fd5ed2126aa458058a1144bbf57ffedcffb05dd81bf3d830cb935d" }, "requirement": "Avoid Spec Kit ceremony for read-only, trivial, or extremely small low-risk work.", "disposition": "MOVE", "targets": ["GLOBAL_POLICY.md", "governance/project/POLICY.md"], "tests": ["test_lightweight_work_does_not_require_lifecycle"], "approval": null },
    { "id": "CAP-ACTUAL-PROJECT-ROOT", "source": { "file": "GLOBAL_POLICY.md", "section": "Existing project authority", "source_sha256": "158693d831fd5ed2126aa458058a1144bbf57ffedcffb05dd81bf3d830cb935d" }, "requirement": "Determine the actual project root before changes or initialization.", "disposition": "MOVE", "targets": ["governance/project/OPERATING_PROTOCOL.md", "governance/manager/speckit_governance.py"], "tests": ["test_project_root_detection"], "approval": null },
    { "id": "CAP-BROWNFIELD-UNDERSTANDING", "source": { "file": "GLOBAL_POLICY.md", "section": "Existing project authority", "source_sha256": "158693d831fd5ed2126aa458058a1144bbf57ffedcffb05dd81bf3d830cb935d" }, "requirement": "Read local rules and model the actual brownfield system rather than inventing replacement architecture.", "disposition": "MOVE", "targets": ["governance/project/POLICY.md", "governance/project/OPERATING_PROTOCOL.md"], "tests": ["test_brownfield_discovery_required"], "approval": null },
    { "id": "CAP-PRESERVE-USER-WORK", "source": { "file": "GLOBAL_POLICY.md", "section": "Existing project authority", "source_sha256": "158693d831fd5ed2126aa458058a1144bbf57ffedcffb05dd81bf3d830cb935d" }, "requirement": "Preserve existing user work and do not overwrite unrelated changes.", "disposition": "MOVE", "targets": ["governance/project/POLICY.md", "governance/schemas/operation-plan.schema.json"], "tests": ["test_dirty_worktree_is_preserved"], "approval": null },
    { "id": "CAP-RESUME-EXISTING-SPECIFY", "source": { "file": "GLOBAL_POLICY.md", "section": "Existing Spec Kit state", "source_sha256": "158693d831fd5ed2126aa458058a1144bbf57ffedcffb05dd81bf3d830cb935d" }, "requirement": "Resume an existing .specify state instead of routinely rerunning init or creating duplicate specifications.", "disposition": "MOVE", "targets": ["governance/project/OPERATING_PROTOCOL.md", "governance/manager/speckit_governance.py"], "tests": ["test_existing_specify_state_is_resumed"], "approval": null },
    { "id": "CAP-CONTROLLED-BROWNFIELD-INIT", "source": { "file": "GLOBAL_POLICY.md", "section": "Existing Spec Kit state", "source_sha256": "158693d831fd5ed2126aa458058a1144bbf57ffedcffb05dd81bf3d830cb935d" }, "requirement": "Allow first initialization of a nonempty brownfield project only through the approved, backup-backed init plan.", "disposition": "REPLACE", "targets": ["governance/project/OPERATING_PROTOCOL.md", "governance/schemas/operation-plan.schema.json"], "tests": ["test_controlled_brownfield_init_uses_backups"], "approval": { "approved_by": "user", "approved_at": "2026-08-21T00:00:00+08:00", "evidence": "Active-thread objective authorizes the dated implementation snapshot." } },
    { "id": "CAP-CONTEXT-ANCHOR-PROTECTION", "source": { "file": "GLOBAL_POLICY.md", "section": "Project authority", "source_sha256": "158693d831fd5ed2126aa458058a1144bbf57ffedcffb05dd81bf3d830cb935d" }, "requirement": "Protect the runtime-selected project context anchor and preserve every byte outside its managed Loader region; never guess a filename.", "disposition": "MOVE", "targets": ["governance/manager/speckit_governance.py", "governance/schemas/governance-manifest.schema.json", "governance/schemas/operation-plan.schema.json"], "tests": ["test_any_declared_anchor_rejects_replace_or_create_mutations", "test_bootstrap_only_appends_to_existing_unmanaged_anchor"], "approval": null },
    { "id": "CAP-AGENT-NEUTRAL-INVOCATION", "source": { "file": "GLOBAL_POLICY.md", "section": "Agent-neutral integration", "source_sha256": "158693d831fd5ed2126aa458058a1144bbf57ffedcffb05dd81bf3d830cb935d" }, "requirement": "Do not assume a fixed Agent brand or universal command syntax; use the installed integration form.", "disposition": "MOVE", "targets": ["GLOBAL_POLICY.md", "governance/resolver/resolver-contract.md"], "tests": ["test_runtime_identity_does_not_use_brand_allowlist"], "approval": null },
    { "id": "CAP-DOCUMENTATION-LANGUAGE-SELECTION", "source": { "file": "GLOBAL_POLICY.md", "section": "Project authority", "source_sha256": "158693d831fd5ed2126aa458058a1144bbf57ffedcffb05dd81bf3d830cb935d" }, "requirement": "Ask the user for an explicit BCP-47 documentation language during plan-init, persist it, and inject it into the selected context-anchor Loader without translating existing documents.", "disposition": "MOVE", "targets": ["governance/manager/speckit_governance.py", "governance/project/PROJECT_CONFIG.default.json", "governance/schemas/project-config.schema.json", "governance/schemas/operation-plan.schema.json"], "tests": ["test_plan_init_records_isolated_rehearsal", "test_plan_init_requires_user_selected_documentation_language"], "approval": null },
    { "id": "CAP-NATIVE-INTEGRATION-PRIORITY", "source": { "file": "GLOBAL_POLICY.md", "section": "Agent-neutral integration", "source_sha256": "158693d831fd5ed2126aa458058a1144bbf57ffedcffb05dd81bf3d830cb935d" }, "requirement": "Use the concrete current Agent native integration when one exists.", "disposition": "MOVE", "targets": ["GLOBAL_POLICY.md", "governance/project/AGENT_ONBOARDING.md"], "tests": ["test_concrete_agent_uses_native_key"], "approval": null },
    { "id": "CAP-NATIVE-INTEGRATION-NO-DOWNGRADE", "source": { "file": "GLOBAL_POLICY.md", "section": "Agent-neutral integration", "source_sha256": "158693d831fd5ed2126aa458058a1144bbf57ffedcffb05dd81bf3d830cb935d" }, "requirement": "When a native integration exists, an unwritable target, permission failure, sandbox block, or install failure is a blocker and must not fall back to generic.", "disposition": "PRESERVE", "targets": ["GLOBAL_POLICY.md", "governance/project/POLICY.md", "governance/project/OPERATING_PROTOCOL.md"], "tests": ["test_native_target_unwritable_is_blocker", "test_native_install_failure_never_proposes_generic", "test_completion_rejected_without_native_managed_files"], "approval": null },
    { "id": "CAP-GENERIC-NOT-NATIVE", "source": { "file": "GLOBAL_POLICY.md", "section": "Agent-neutral integration", "source_sha256": "158693d831fd5ed2126aa458058a1144bbf57ffedcffb05dd81bf3d830cb935d" }, "requirement": "Generic is only an explicitly approved Agent-neutral option and must not claim native Skills or Commands capability.", "disposition": "MOVE", "targets": ["GLOBAL_POLICY.md", "governance/project/AGENT_ONBOARDING.md", "governance/project/PROJECT_CONFIG.default.json"], "tests": ["test_generic_requires_explicit_approval", "test_generic_never_claims_native_capability"], "approval": null },